{
  "protocol_version": "0.5.0",
  "response_artifact": {
    "artifact_id": "artifact_model-response-001",
    "digest": "sha256:31dada52a47a2630f2c77fbf9a9b74912a067db9e0b62c8410f745cf65e9c64c"
  },
  "timing_resolution_ms": 1,
  "segments": [
    {
      "byte_offset": 0,
      "byte_length": 12,
      "captured_at": "2026-07-27T16:20:01.101Z"
    },
    {
      "byte_offset": 12,
      "byte_length": 9,
      "captured_at": "2026-07-27T16:20:01.143Z"
    }
  ],
  "warnings": [
    "Ranges record observed byte availability, not exact token timing."
  ]
}
